{
  "schema_version": "1.0.0",
  "skill": "feature-qa",
  "run_id": "feature-qa-run-001",
  "generated_at": "2026-07-22T12:00:00Z",
  "source_references": [
    "ticket:QA-100",
    "commit:abc123"
  ],
  "context_hash": "aaaaaaaaaaaaaaaaaaaaaaaaaaaaaaaaaaaaaaaaaaaaaaaaaaaaaaaaaaaaaaaa",
  "approvals": [
    {
      "id": "approval-1",
      "gate": "Gate 1 · approve environment",
      "approver": "QA Lead",
      "role": "release-approver",
      "approved_at": "2026-07-22T10:00:00Z",
      "expires_at": "2026-07-23T10:00:00Z",
      "context_hash": "aaaaaaaaaaaaaaaaaaaaaaaaaaaaaaaaaaaaaaaaaaaaaaaaaaaaaaaaaaaaaaaa",
      "document_hash": "bbbbbbbbbbbbbbbbbbbbbbbbbbbbbbbbbbbbbbbbbbbbbbbbbbbbbbbbbbbbbbbb",
      "valid": true
    },
    {
      "id": "approval-2",
      "gate": "Gate 2 · approve scope",
      "approver": "QA Lead",
      "role": "release-approver",
      "approved_at": "2026-07-22T10:00:00Z",
      "expires_at": "2026-07-23T10:00:00Z",
      "context_hash": "aaaaaaaaaaaaaaaaaaaaaaaaaaaaaaaaaaaaaaaaaaaaaaaaaaaaaaaaaaaaaaaa",
      "document_hash": "bbbbbbbbbbbbbbbbbbbbbbbbbbbbbbbbbbbbbbbbbbbbbbbbbbbbbbbbbbbbbbbb",
      "valid": true
    },
    {
      "id": "approval-3",
      "gate": "Gate 3 · approve actions",
      "approver": "QA Lead",
      "role": "release-approver",
      "approved_at": "2026-07-22T10:00:00Z",
      "expires_at": "2026-07-23T10:00:00Z",
      "context_hash": "aaaaaaaaaaaaaaaaaaaaaaaaaaaaaaaaaaaaaaaaaaaaaaaaaaaaaaaaaaaaaaaa",
      "document_hash": "bbbbbbbbbbbbbbbbbbbbbbbbbbbbbbbbbbbbbbbbbbbbbbbbbbbbbbbbbbbbbbbb",
      "valid": true
    },
    {
      "id": "approval-4",
      "gate": "Gate 4 · confirm finding",
      "approver": "QA Lead",
      "role": "release-approver",
      "approved_at": "2026-07-22T10:00:00Z",
      "expires_at": "2026-07-23T10:00:00Z",
      "context_hash": "aaaaaaaaaaaaaaaaaaaaaaaaaaaaaaaaaaaaaaaaaaaaaaaaaaaaaaaaaaaaaaaa",
      "document_hash": "bbbbbbbbbbbbbbbbbbbbbbbbbbbbbbbbbbbbbbbbbbbbbbbbbbbbbbbbbbbbbbbb",
      "valid": true
    },
    {
      "id": "approval-5",
      "gate": "Gate 5 · approve test change",
      "approver": "QA Lead",
      "role": "release-approver",
      "approved_at": "2026-07-22T10:00:00Z",
      "expires_at": "2026-07-23T10:00:00Z",
      "context_hash": "aaaaaaaaaaaaaaaaaaaaaaaaaaaaaaaaaaaaaaaaaaaaaaaaaaaaaaaaaaaaaaaa",
      "document_hash": "bbbbbbbbbbbbbbbbbbbbbbbbbbbbbbbbbbbbbbbbbbbbbbbbbbbbbbbbbbbbbbbb",
      "valid": true
    },
    {
      "id": "approval-6",
      "gate": "Gate 6 · review and publish",
      "approver": "QA Lead",
      "role": "release-approver",
      "approved_at": "2026-07-22T10:00:00Z",
      "expires_at": "2026-07-23T10:00:00Z",
      "context_hash": "aaaaaaaaaaaaaaaaaaaaaaaaaaaaaaaaaaaaaaaaaaaaaaaaaaaaaaaaaaaaaaaa",
      "document_hash": "bbbbbbbbbbbbbbbbbbbbbbbbbbbbbbbbbbbbbbbbbbbbbbbbbbbbbbbbbbbbbbbb",
      "valid": true
    }
  ],
  "claims": [
    {
      "id": "claim-1",
      "text": "The expected result was directly observed.",
      "classification": "observed",
      "evidence_ids": [
        "evidence-1"
      ]
    }
  ],
  "evidence": [
    {
      "id": "evidence-1",
      "type": "trace",
      "source_reference": "ticket:QA-100",
      "captured_at": "2026-07-22T11:30:00Z",
      "integrity_hash": "cccccccccccccccccccccccccccccccccccccccccccccccccccccccccccccccc",
      "privacy_reviewed": true
    }
  ],
  "results": [
    {
      "id": "result-1",
      "required": true,
      "status": "PASS",
      "expected": "The approved expected state is visible.",
      "actual": "The approved expected state was observed.",
      "evidence_ids": [
        "evidence-1"
      ]
    }
  ],
  "findings": [],
  "decision": {
    "outcome": "PASS",
    "reason": "The evidence supports the selected outcome.",
    "evidence_ids": [
      "evidence-1"
    ]
  },
  "safety": {
    "permission_scope_verified": true,
    "secrets_in_output": false,
    "personal_data_in_output": false,
    "external_writes": [],
    "accepted_risks": [],
    "assumptions": [],
    "uncertainties": []
  },
  "outputs": [
    "run-context.json",
    "approval-ledger.jsonl",
    "impact-analysis.md",
    "test-plan.md",
    "data-plan.md",
    "execution-ledger.jsonl",
    "evidence-manifest.json",
    "findings/",
    "regression/",
    "report.yaml",
    "report.html",
    "summary.md",
    "cleanup-report.md"
  ],
  "cleanup": {
    "status": "complete",
    "residual_resources": []
  }
}
